{
  "$schema": "./kit-copy-locale.schema.json",
  "$comment": "ja translation of en.json, produced against glossary.json and not yet reviewed by a native speaker (reviewed: false; a release follow-up, not a merge blocker). Register: polite です・ます for sentences, short noun or verb forms for buttons, as in Apple and Google Japanese UI.",
  "kitCopyVersion": 1,
  "locale": "ja",
  "reviewed": false,
  "glossaryVersion": 1,
  "messages": {
    "common.cancel": "キャンセル",
    "common.close": "閉じる",
    "common.back": "戻る",
    "common.continue": "続ける",
    "common.done": "完了",
    "common.save": "保存",
    "common.notNow": "今はしない",
    "common.later": "後で",
    "common.tryAgain": "再試行",
    "common.copy": "コピー",
    "common.copied": "コピーしました",
    "common.review": "確認",
    "common.paste": "ペースト",
    "common.working": "処理中…",
    "common.loading": "読み込み中…",
    "common.signOut": "サインアウト",
    "common.manage": "管理",
    "common.reconnect": "再接続",
    "common.dismiss": "閉じる",
    "common.byDeveloper": "開発：{developer}",
    "part.thisDevice": "{formFactor, select, iphone {このiPhone} ipad {このiPad} mac {このMac} phone {このスマートフォン} tablet {このタブレット} computer {このコンピュータ} tv {このテレビ} other {このデバイス}}",
    "part.thisDeviceTitle": "{formFactor, select, iphone {このiPhone} ipad {このiPad} mac {このMac} phone {このスマートフォン} tablet {このタブレット} computer {このコンピュータ} tv {このテレビ} other {このデバイス}}",
    "part.platform.macos": "macOS",
    "part.platform.ios": "iOS",
    "part.platform.ipados": "iPadOS",
    "part.platform.android": "Android",
    "part.platform.windows": "Windows",
    "part.platform.linux": "Linux",
    "part.platform.web": "Web",
    "part.platform.tvos": "tvOS",
    "part.platform.visionos": "visionOS",
    "part.platform.watchos": "watchOS",
    "part.platform.chromeos": "ChromeOS",
    "part.platform.steamos": "SteamOS",
    "part.platform.freebsd": "FreeBSD",
    "part.keyField.label": "ライセンスキー",
    "part.keyField.placeholder": "キーをペースト",
    "part.keyField.forProduct": "{product}のキー",
    "part.keyField.verdict": "{product} {tier} · {term}",
    "part.keyField.cutShort": "このキーは途中で切れています。{prefix}以降が{used}文字しかありません（必要な文字数：{limit, plural, other {#文字}}）。",
    "part.keyField.malformed": "ライセンスキーではないようです。キーはpkey_で始まります。",
    "part.keyField.empty": "先にライセンスキーを入力してください。",
    "part.code.label": "サインインコード",
    "part.qr.enlarge": "拡大表示",
    "part.qr.scanInstead": "代わりにスマートフォンでスキャン",
    "part.seatMeter.caption": "{limit}台中{used}台を使用中",
    "part.poweredBy": "Powered by Polaris Locker",
    "part.status.ok": "有効",
    "part.status.grace": "オフライン",
    "part.status.expired": "期限切れ",
    "part.status.revoked": "取り消し済み",
    "part.status.inactive": "未アクティベート",
    "part.status.blocked": "ブロック中",
    "part.status.notApplicable": "不要",
    "a11y.closeDialog": "ダイアログを閉じる",
    "a11y.busy": "処理中",
    "a11y.copyCode": "コードをコピー",
    "a11y.copyAddress": "アドレスをコピー",
    "a11y.externalLink": "ブラウザで開きます",
    "a11y.qr": "サインインページを開くQRコード",
    "a11y.qrRequest": "リクエストコードのQRコード",
    "a11y.qrManage": "デバイス管理ページを開くQRコード",
    "a11y.code": "サインインコード：{code}",
    "a11y.seatMeter": "{limit, plural, other {#台のデバイス}}中{used}台を使用中",
    "a11y.productIcon": "{product}のアイコン",
    "a11y.locked": "ロック中",
    "a11y.progress": "{total}中{size}をダウンロード済み",
    "a11y.formFactor": "{formFactor, select, iphone {iPhone} ipad {iPad} mac {Mac} phone {スマートフォン} tablet {タブレット} computer {コンピュータ} tv {テレビ} other {デバイス}}",
    "a11y.toastTimer": "{time}後に閉じます",
    "a11y.selected": "選択済み",
    "a11y.renameDevice": "{device}の名前を変更",
    "a11y.removeDevice": "{device}を削除",
    "gate.checking": "ライセンスを確認しています…",
    "gate.error.title": "{product}を起動できませんでした",
    "boot.starting": "起動しています…",
    "boot.syncing": "アップデートを確認しています…",
    "boot.deciding": "新しいバージョンを探しています…",
    "boot.fetching": "コンテンツをダウンロードしています…",
    "boot.fetchingProgress": "コンテンツをダウンロード中 · {total}中{size}",
    "boot.ready": "準備完了",
    "boot.offline.title": "オフラインです",
    "boot.offline.body": "インターネットに接続して、もう一度お試しください。",
    "boot.offline.playable": "一部のコンテンツをダウンロードできませんでした。インストール済みのコンテンツで続けるか、接続してもう一度お試しください。",
    "boot.continueOffline": "オフラインで続ける",
    "boot.declined.title": "コンテンツ未ダウンロード",
    "boot.declined.body": "{product}の起動にはこのコンテンツが必要です。準備ができたらダウンロードしてください。",
    "boot.rolledBack": "前回のアップデートが起動しなかったため、以前のバージョンに戻しました。",
    "boot.consent.title": "コンテンツをダウンロードしますか？",
    "boot.consent.body": "{product}には{size}の新しいコンテンツが必要です。",
    "boot.consent.bodyMetered": "{product}には{size}の新しいコンテンツが必要です。現在、従量制の接続を使用しています。",
    "boot.consent.download": "ダウンロード",
    "boot.error.body": "問題が続く場合は、アプリを再起動してください。",
    "welcome.title": "{product}へようこそ",
    "common.welcomeNoProductTitle": "ようこそ",
    "common.signInToContinue": "続けるにはサインインしてください。",
    "welcome.lede": "続けるには、サインインするかライセンスキーを使用してください。",
    "welcome.ledeKeyOnly": "続けるには、ライセンスキーを入力してください。",
    "welcome.ledeSignInOnly": "{product}を使うにはサインインしてください。",
    "welcome.signIn": "サインイン",
    "welcome.useKey": "ライセンスキーを使う",
    "welcome.trial": "無料トライアルを開始",
    "welcome.continueFree": "無料で続ける",
    "welcome.restore": "購入を復元",
    "welcome.offline": "オフラインでアクティベート",
    "signIn.title": "{product}にサインイン",
    "signIn.noMethods": "{product}で利用できるサインイン方法はありません。代わりにライセンスキーを使用してください。",
    "signIn.methodError": "{method}でのサインインが完了しませんでした。もう一度お試しください。",
    "signInHandoff.starting": "サインインコードを取得しています…",
    "signInHandoff.scan": "スマートフォンでコードをスキャンするか、{url}にアクセスしてこのコードを入力してください。",
    "signInHandoff.scanTv": "スマートフォンでQRコードを読み取るか、このアドレスにアクセスして下のコードを入力してください。",
    "signInHandoff.linkCopied": "リンクをコピーしました",
    "signInHandoff.confirm": "完了するには、サインインページで「Sign in on {device}」を選択してください。",
    "signInHandoff.ok": "サインインしました",
    "signInHandoff.newCode": "新しいコードを取得",
    "activate.title": "ライセンスキーを入力",
    "activate.lede": "購入時のメールに記載されています。",
    "activate.submit": "ライセンスをアクティベート",
    "common.activateLicense": "ライセンスをアクティベート",
    "activate.busy": "アクティベートしています…",
    "offlineActivation.title": "オフラインアクティベーション",
    "offlineActivation.request": "このリクエストコードを、ライセンスの提供元に送ってください。",
    "offlineActivation.copyCode": "コードをコピー",
    "offlineActivation.codeCopied": "コードをコピーしました",
    "offlineActivation.loadHint": "返送されたアクティベーションファイルを読み込むか、そのテキストをペーストしてください。",
    "offlineActivation.loadFile": "ファイルを読み込む…",
    "offlineActivation.paste": "ここにアクティベーションテキストをペースト",
    "offlineActivation.submit": "ファイルからアクティベート",
    "offlineActivation.dropHint": "このウインドウにファイルをドロップすることもできます。",
    "offlineActivation.done": "オフラインファイルからアクティベートしました。",
    "offlineActivation.empty": "先にアクティベーションファイルを読み込むか、ペーストしてください。",
    "deviceLimit.title": "デバイスを置き換える",
    "deviceLimit.heading": "このライセンスは{limit, plural, other {#台のデバイス}}中{used}台で使用されています",
    "deviceLimit.lede": "{formFactor, select, iphone {このiPhone} ipad {このiPad} mac {このMac} phone {このスマートフォン} tablet {このタブレット} computer {このコンピュータ} tv {このテレビ} other {このデバイス}}で使うには、いずれかのデバイスを置き換えてください。置き換えたデバイスは後で戻すこともできます。",
    "deviceLimit.confirmTitle": "{device}を置き換えますか？",
    "deviceLimit.consequence": "{device}は{product}からサインアウトし、{thisDevice}がその枠を使用します。この件についてはメールでお知らせします。",
    "deviceLimit.primary": "置き換えて続ける",
    "deviceLimit.removed": "{device}を置き換えました。{product}を続行します。",
    "deviceLimit.failed": "{device}を置き換えられませんでした。もう一度お試しください。",
    "deviceLimit.browser": "ブラウザでデバイスを置き換えてください。完了すると{product}が続行します。",
    "deviceLimit.openBrowser": "ブラウザで開く",
    "deviceLimit.scan": "コードをスキャンして、スマートフォンでデバイスを置き換えてください。",
    "deviceLimit.noManage": "別のデバイスで{product}からサインアウトしてから、もう一度お試しください。",
    "devices.title": "お使いのデバイス",
    "devices.lede": "このライセンスを使用しているデバイス。",
    "devices.meta": "{platform} · 最終使用：{when}",
    "devices.count": "{count, plural, other {#台のデバイス}}",
    "devices.unnamed": "名前のないデバイス",
    "devices.rename": "名前を変更",
    "devices.renameLabel": "デバイス名",
    "devices.remove": "削除",
    "devices.removeConfirm": "{device}を削除しますか？{product}からサインアウトされます。",
    "devices.empty": "このライセンスを使用しているデバイスはまだありません。",
    "devices.loadFailed": "デバイスを読み込めませんでした。",
    "devices.renameFailed": "{device}の名前を変更できませんでした。もう一度お試しください。",
    "devices.removeFailed": "{device}を削除できませんでした。もう一度お試しください。",
    "devices.browser": "ブラウザでデバイスを管理してください。",
    "devices.manage": "デバイスを管理",
    "update.title": "{product} {version}",
    "update.availableTitle": "アップデートがあります",
    "update.current": "現在のバージョン：{version} · ダウンロードサイズ：{size}",
    "update.whatsNew": "新機能",
    "update.allChanges": "{version}のすべての変更点",
    "update.later": "後で",
    "update.restartWhenReady": "準備ができたら再起動",
    "update.restartNow": "今すぐ再起動",
    "update.skipVersion": "このバージョンをスキップ",
    "update.install": "今すぐアップデート",
    "update.downloading": "ダウンロード中 · {total}中{size}",
    "update.timeLeft": "残り約{time}",
    "update.readyTitle": "{product} {version}の準備ができました",
    "update.readyBody": "アップデートを完了するには{product}を再起動してください。",
    "update.mandatoryTitle": "{product}を引き続き使うにはアップデートしてください",
    "update.mandatoryBody": "このバージョンはサポートが終了しました。",
    "update.blockedTitle": "このバージョンはサポートが終了しました",
    "update.blockedBody": "ここではまだアップデートを利用できません。当面は{product}を引き続き使用できます。",
    "update.critical": "このアップデートには重要なセキュリティ修正が含まれています。",
    "update.appStore": "App Storeでアップデート",
    "update.googlePlay": "Google Playでアップデート",
    "update.steam": "Steamで入手",
    "update.openStore": "{store}を開く",
    "update.testflight": "TestFlightを開く",
    "update.altstore": "AltStoreを開く",
    "update.reload": "再読み込み",
    "update.platform.steam": "Steamがインストールします。届かない場合はSteamを再起動してください。",
    "update.platform.itch": "itchアプリがインストールします。",
    "update.platform.store": "ソフトウェアセンターがインストールします。",
    "update.platform.appInstaller": "次回{product}を起動したときにWindowsがインストールします。",
    "update.platform.command": "インストールするには{command}を実行してください。",
    "update.platform.web": "ページを再読み込みすると入手できます。",
    "update.platform.package": "パッケージマネージャーがインストールします。",
    "update.platform.generic": "{product}を入手したストアまたはプラットフォームからインストールされます。",
    "update.revokedContent": "{product}の一部のコンテンツは取り下げられたため、使用できません。続けるには{product}をアップデートしてください。",
    "update.upToDate": "最新の状態です",